{
  "schema_version": "1.0.0",
  "pr_number": 999,
  "base_branch": "develop",
  "verdict": "approved",
  "merge_method": "squash",
  "delete_branch": true,
  "reviewer_summary": "Example verdict for local dry-run testing. All acceptance criteria met.",
  "evaluated_at": "2026-04-13T00:00:00Z",
  "reviewer_agent_version": "1.13.26",
  "ci_required": true
}
